GEO_ID,NAME,Median_value
310M400US10580,"Albany-Schenectady-Troy, NY Metro Area",226000
310M400US11100,"Amarillo, TX Metro Area",160900
310M400US11460,"Ann Arbor, MI Metro Area",289300
310M400US12100,"Atlantic City-Hammonton, NJ Metro Area",225500
310M400US14100,"Bloomsburg-Berwick, PA Metro Area",173400
310M400US15680,"California-Lexington Park, MD Metro Area",315300
310M400US20940,"El Centro, CA Metro Area",226700
310M400US21300,"Elmira, NY Metro Area",119700
310M400US27180,"Jackson, TN Metro Area",140200
310M400US28580,"Key West, FL Micro Area",495600
310M400US39340,"Provo-Orem, UT Metro Area",333800
310M400US43300,"Sherman-Denison, TX Metro Area",185800
310M400US44180,"Springfield, MO Metro Area",153300
310M400US48980,"Wilson, NC Micro Area",135900
310M400US49220,"Wisconsin Rapids-Marshfield, WI Micro Area",136200
310M400US10500,"Albany, GA Metro Area",128000
310M400US14860,"Bridgeport-Stamford-Norwalk, CT Metro Area",441200
310M400US16220,"Casper, WY Metro Area",216500
310M400US16500,"Centralia, WA Micro Area",255400
310M400US17860,"Columbia, MO Metro Area",191400
310M400US19140,"Dalton, GA Metro Area",134200
310M400US24020,"Glens Falls, NY Metro Area",180900
310M400US25500,"Harrisonburg, VA Metro Area",216400
310M400US27860,"Jonesboro, AR Metro Area",156800
310M400US29020,"Kokomo, IN Metro Area",122400
310M400US31260,"Lufkin, TX Micro Area",143700
310M400US32580,"McAllen-Edinburg-Mission, TX Metro Area",116200
310M400US33260,"Midland, TX Metro Area",233000
310M400US33540,"Missoula, MT Metro Area",304100
310M400US37900,"Peoria, IL Metro Area",144500
310M400US40700,"Roseburg, OR Micro Area",219700
310M400US40780,"Russellville, AR Micro Area",119700
310M400US47700,"Warsaw, IN Micro Area",146100
310M400US49780,"Zanesville, OH Micro Area",132900
